{
  "taskId": "example-task-001",
  "iterationNumber": 1,
  "timestamp": "2025-12-15T10:01:00Z",
  "qaStatusBefore": {
    "total": 10,
    "passing": 0,
    "failing": 10
  },
  "targetTest": {
    "name": "Dashboard renders without errors",
    "description": "Verifies that Dashboard component renders without throwing errors",
    "filePath": "tests/qa/dashboard/dashboard.test.tsx"
  },
  "codeChanges": {
    "summary": "Created Dashboard component with basic structure and exports",
    "filesModified": [
      "components/Dashboard/Dashboard.tsx",
      "components/Dashboard/index.ts"
    ],
    "linesAdded": 45,
    "linesRemoved": 0
  },
  "qaStatusAfter": {
    "total": 10,
    "passing": 1,
    "failing": 9,
    "result": "IMPROVED"
  },
  "duration": 120,
  "notes": "First iteration: Created basic Dashboard component structure. One test now passing."
}
